{
  "schema_version": 1,
  "kind": "ledger_metadata_capture",
  "source": "rpc_ledger_meta",
  "network": "SYNTHETIC-NETWORK",
  "from_ledger": 100,
  "to_ledger": 100,
  "processed_through": 100,
  "sequence_coverage": "COMPLETE_ENDPOINT_SEQUENCE",
  "source_authentication": "UNVERIFIED",
  "history_completeness": "UNKNOWN",
  "metadata_commitment": "NOT_VERIFIED",
  "state_changes": "NOT_APPLIED",
  "final_verdict": "UNDETERMINED",
  "ledgers": [
    {
      "sequence": 100,
      "protocol_version": 29,
      "close_time": 1700000100,
      "hash": "558e730b50daab5ce242bc3f7566aad7b27ade8b8547e2995e84ebeeda2ab9c2",
      "previous_hash": "0700000000000000000000000000000000000000000000000000000000000000",
      "metadata_version": 2,
      "metadata_sha256": "9a4f914838790e848dadb640b93a5090669c82fdd82bec4d0586b4d8ccf45c58",
      "header_xdr": "VY5zC1Daq1ziQrw/dWaq17J63ouFR+KZXoTr7toqucIAAAAdBwAAAAAAAAAAAAAAAAAAAAAAAAAAAAAAAAAAAAAAAAAAAAAAAAAAAAAAAAAAAAAAAAAAAAAAAAAAAAAAAAAAAAAAAABlU/FkAAAAAAAAAAAAAAAAAAAAAAAAAAAAAAAAAAAAAAAAAAAAAAAAAAAAAAAAAAAAAAAAAAAAAAAAAAAAAAAAAAAAAAAAAAAAAAAAAAAAZAAAAAAAAAAAAAAAAAAAAAAAAAAAAAAAAAAAAAAAAAAAAAAAAAAAAAAAAAAAAAAAAAAAAAAAAAAAAAAAAAAAAAAAAAAAAAAAAAAAAAAAAAAAAAAAAAAAAAAAAAAAAAAAAAAAAAAAAAAAAAAAAAAAAAAAAAAAAAAAAAAAAAAAAAAAAAAAAAAAAAAAAAAAAAAAAAAAAAAAAAAAAAAAAAAAAAAAAAAAAAAAAAAAAAAAAAAA",
      "metadata_xdr": "AAAAAgAAAABVjnMLUNqrXOJCvD91ZqrXsnrei4VH4plehOvu2iq5wgAAAB0HAAAAAAAAAAAAAAAAAAAAAAAAAAAAAAAAAAAAAAAAAAAAAAAAAAAAAAAAAAAAAAAAAAAAAAAAAAAAAAAAAAAAAAAAAGVT8WQAAAAAAAAAAAAAAAAAAAAAAAAAAAAAAAAAAAAAAAAAAAAAAAAAAAAAAAAAAAAAAAAAAAAAAAAAAAAAAAAAAAAAAAAAAAAAAAAAAABkAAAAAAAAAAAAAAAAAAAAAAAAAAAAAAAAAAAAAAAAAAAAAAAAAAAAAAAAAAAAAAAAAAAAAAAAAAAAAAAAAAAAAAAAAAAAAAAAAAAAAAAAAAAAAAAAAAAAAAAAAAAAAAAAAAAAAAAAAAAAAAAAAAAAAAAAAAAAAAAAAAAAAAAAAAAAAAAAAAAAAAAAAAAAAAAAAAAAAAAAAAAAAAAAAAAAAAAAAAAAAAAAAAAAAAAAAAAAAAABBwAAAAAAAAAAAAAAAAAAAAAAAAAAAAAAAAAAAAAAAAAAAAAAAAAAAQAAAAABAAAAAAAAAAAAAAAAAAAAAAAAAAAAAAAAAAAAAAAAAAAAAAAAAAAAAAAAAAAAAAAAAAAAAAAAAAAAAAQAAAAAAAAAAAAAAAIAAAAAAAAAAgAAAAMAAABaAAAABgAAAAAAAAABAAAAAAAAAAAAAAAAAAAAAAAAAAAAAAAAAAAAAAAAAAAAAAAWAAAAA/8AYQAAAAABAAAADQAAACCqqqqqqqqqqqqqqqqqqqqqqqqqqqqqqqqqqqqqqqqqqgAAAAAAAAABAAAAWgAAAAYAAAAAAAAAAQAAAAAAAAAAAAAAAAAAAAAAAAAAAAAAAAAAAAAAAAAAAAAAFgAAAAP/AGEAAAAAAQAAAA0AAAAgu7u7u7u7u7u7u7u7u7u7u7u7u7u7u7u7u7u7u7u7u7sAAAAAAAAAAAAAAAAAAAACAAAAAwAAAFoAAAAGAAAAAAAAAAEAAAAAAAAAAAAAAAAAAAAAAAAAAAAAAAAAAAAAAAAAAAAAABYAAAAD/wBhAAAAAAEAAAANAAAAILu7u7u7u7u7u7u7u7u7u7u7u7u7u7u7u7u7u7u7u7u7AAAAAAAAAAEAAABaAAAABgAAAAAAAAABAAAAAAAAAAAAAAAAAAAAAAAAAAAAAAAAAAAAAAAAAAAAAAAWAAAAA/8AYQAAAAABAAAADQAAACCqqqqqqqqqqqqqqqqqqqqqqqqqqqqqqqqqqqqqqqqqqgAAAAAAAAAAAAAAAAAAAAAAAAAAAAAAAAAAAAAAAAAAAAAAAAAAAAAAAAAAAAAAAA=="
    }
  ],
  "errors": []
}
