{
  "schema_version": 1,
  "kind": "ledger_metadata_capture",
  "source": "rpc_ledger_meta",
  "network": "SYNTHETIC-NETWORK",
  "from_ledger": 101,
  "to_ledger": 101,
  "processed_through": 101,
  "sequence_coverage": "COMPLETE_ENDPOINT_SEQUENCE",
  "source_authentication": "UNVERIFIED",
  "history_completeness": "UNKNOWN",
  "metadata_commitment": "NOT_VERIFIED",
  "state_changes": "NOT_APPLIED",
  "final_verdict": "UNDETERMINED",
  "ledgers": [
    {
      "sequence": 101,
      "protocol_version": 29,
      "close_time": 1700000105,
      "hash": "2b45749742129dcf6e22734acfead6580acba22a11586211e1de0a31275153c4",
      "previous_hash": "558e730b50daab5ce242bc3f7566aad7b27ade8b8547e2995e84ebeeda2ab9c2",
      "metadata_version": 2,
      "metadata_sha256": "16e9684354c43c371eaf2381c2a125d29128713cb102180c507ecf8466ebb6b7",
      "header_xdr": "K0V0l0ISnc9uInNKz+rWWArLoioRWGIR4d4KMSdRU8QAAAAdVY5zC1Daq1ziQrw/dWaq17J63ouFR+KZXoTr7toqucIAAAAAAAAAAAAAAAAAAAAAAAAAAAAAAAAAAAAAAAAAAAAAAABlU/FpAAAAAAAAAAAAAAAAAAAAAAAAAAAAAAAAAAAAAAAAAAAAAAAAAAAAAAAAAAAAAAAAAAAAAAAAAAAAAAAAAAAAAAAAAAAAAAAAAAAAZQAAAAAAAAAAAAAAAAAAAAAAAAAAAAAAAAAAAAAAAAAAAAAAAAAAAAAAAAAAAAAAAAAAAAAAAAAAAAAAAAAAAAAAAAAAAAAAAAAAAAAAAAAAAAAAAAAAAAAAAAAAAAAAAAAAAAAAAAAAAAAAAAAAAAAAAAAAAAAAAAAAAAAAAAAAAAAAAAAAAAAAAAAAAAAAAAAAAAAAAAAAAAAAAAAAAAAAAAAAAAAAAAAAAAAAAAAA",
      "metadata_xdr": "AAAAAgAAAAArRXSXQhKdz24ic0rP6tZYCsuiKhFYYhHh3goxJ1FTxAAAAB1VjnMLUNqrXOJCvD91ZqrXsnrei4VH4plehOvu2iq5wgAAAAAAAAAAAAAAAAAAAAAAAAAAAAAAAAAAAAAAAAAAAAAAAGVT8WkAAAAAAAAAAAAAAAAAAAAAAAAAAAAAAAAAAAAAAAAAAAAAAAAAAAAAAAAAAAAAAAAAAAAAAAAAAAAAAAAAAAAAAAAAAAAAAAAAAABlAAAAAAAAAAAAAAAAAAAAAAAAAAAAAAAAAAAAAAAAAAAAAAAAAAAAAAAAAAAAAAAAAAAAAAAAAAAAAAAAAAAAAAAAAAAAAAAAAAAAAAAAAAAAAAAAAAAAAAAAAAAAAAAAAAAAAAAAAAAAAAAAAAAAAAAAAAAAAAAAAAAAAAAAAAAAAAAAAAAAAAAAAAAAAAAAAAAAAAAAAAAAAAAAAAAAAAAAAAAAAAAAAAAAAAAAAAAAAAABVY5zC1Daq1ziQrw/dWaq17J63ouFR+KZXoTr7toqucIAAAAAAAAAAQAAAAACAAAAAAAAAAAAAAAAAAAAAAAAAAAAAAAAAAAAAAAAAAAAAAAAAAAAAAAAAAAAAAAAAAAAAAAAAAAAAAQAAAAAAAAAAAAAAAEAAAAAAAAAAgAAAAMAAABkAAAABgAAAAAAAAABAQAAAAAAAAAAAAAAAAAAAAAAAAAAAAAAAAAAAAAAAAAAAAAUAAAAAQAAABMAAAACAAAAAQAAAAAAAAAAAAAAAAAAAAAAAAAAAAAAAAAAAAAAAAAAAAAAA/8AYQAAAAAAAAAAAAAAAAEAAABkAAAABgAAAAAAAAABAQAAAAAAAAAAAAAAAAAAAAAAAAAAAAAAAAAAAAAAAAAAAAAUAAAAAQAAABMAAAAACQAAAAAAAAAAAAAAAAAAAAAAAAAAAAAAAAAAAAAAAAAAAAAAAAAAAAAAAAAAAAAAAAAAAAAAAAAAAAAAAAAAAAAAAAAAAAAAAAAAAAAAAAAAAAAA"
    }
  ],
  "errors": []
}
