{
  "schema_version": 1,
  "kind": "ledger_metadata_capture",
  "source": "rpc_ledger_meta",
  "network": "SYNTHETIC-NETWORK",
  "from_ledger": 100,
  "to_ledger": 100,
  "processed_through": 100,
  "sequence_coverage": "COMPLETE_ENDPOINT_SEQUENCE",
  "source_authentication": "UNVERIFIED",
  "history_completeness": "UNKNOWN",
  "metadata_commitment": "NOT_VERIFIED",
  "state_changes": "NOT_APPLIED",
  "final_verdict": "UNDETERMINED",
  "ledgers": [
    {
      "sequence": 100,
      "protocol_version": 29,
      "close_time": 1700000100,
      "hash": "0426c71ac9b9662f3fe074e26b81c2e53a46fb65bcabe2b2aee497dbd7383fd4",
      "previous_hash": "0000000000000000000000000000000000000000000000000000000000000000",
      "metadata_version": 2,
      "metadata_sha256": "8437728d45a4f6cdcdf9027db1bd80a62d15e00baa9d766b4f40de60dc91fc10",
      "header_xdr": "BCbHGsm5Zi8/4HTia4HC5TpG+2W8q+KyruSX29c4P9QAAAAdAAAAAAAAAAAAAAAAAAAAAAAAAAAAAAAAAAAAAAAAAAAAAAAAAAAAAAAAAAAAAAAAAAAAAAAAAAAAAAAAAAAAAAAAAABlU/FkAAAAAAAAAAAAAAAAAAAAAAAAAAAAAAAAAAAAAAAAAAAAAAAAAAAAAAAAAAAAAAAAAAAAAAAAAAAAAAAAAAAAAAAAAAAAAAAAAAAAZAAAAAAAAAAAAAAAAAAAAAAAAAAAAAAAAAAAAAAAAAAAAAAAAAAAAAAAAAAAAAAAAAAAAAAAAAAAAAAAAAAAAAAAAAAAAAAAAAAAAAAAAAAAAAAAAAAAAAAAAAAAAAAAAAAAAAAAAAAAAAAAAAAAAAAAAAAAAAAAAAAAAAAAAAAAAAAAAAAAAAAAAAAAAAAAAAAAAAAAAAAAAAAAAAAAAAAAAAAAAAAAAAAAAAAAAAAA",
      "metadata_xdr": "AAAAAgAAAAAEJscayblmLz/gdOJrgcLlOkb7Zbyr4rKu5Jfb1zg/1AAAAB0AAAAAAAAAAAAAAAAAAAAAAAAAAAAAAAAAAAAAAAAAAAAAAAAAAAAAAAAAAAAAAAAAAAAAAAAAAAAAAAAAAAAAAAAAAGVT8WQAAAAAAAAAAAAAAAAAAAAAAAAAAAAAAAAAAAAAAAAAAAAAAAAAAAAAAAAAAAAAAAAAAAAAAAAAAAAAAAAAAAAAAAAAAAAAAAAAAABkAAAAAAAAAAAAAAAAAAAAAAAAAAAAAAAAAAAAAAAAAAAAAAAAAAAAAAAAAAAAAAAAAAAAAAAAAAAAAAAAAAAAAAAAAAAAAAAAAAAAAAAAAAAAAAAAAAAAAAAAAAAAAAAAAAAAAAAAAAAAAAAAAAAAAAAAAAAAAAAAAAAAAAAAAAAAAAAAAAAAAAAAAAAAAAAAAAAAAAAAAAAAAAAAAAAAAAAAAAAAAAAAAAAAAAAAAAAAAAABAAAAAAAAAAAAAAAAAAAAAAAAAAAAAAAAAAAAAAAAAAAAAAAAAAAAAgAAAAABAAAAAAAAAAAAAAAAAAAAAAAAAAAAAAAAAAAAAAAAAAAAAAAAAAAAAAAAAAAAAAAAAAAAAAAAAQAAAAMAAABaAAAABgAAAAAAAAABAAAAAAAAAAAAAAAAAAAAAAAAAAAAAAAAAAAAAAAAAAAAAAAWAAAAA/8AYQAAAAABAAAADQAAACCqqqqqqqqqqqqqqqqqqqqqqqqqqqqqqqqqqqqqqqqqqgAAAAAAAAAEAAAAAAAAAAEAAAADAAAAWgAAAAYAAAAAAAAAAQAAAAAAAAAAAAAAAAAAAAAAAAAAAAAAAAAAAAAAAAAAAAAAFgAAAAP/AGEAAAAAAQAAAA0AAAAgqqqqqqqqqqqqqqqqqqqqqqqqqqqqqqqqqqqqqqqqqqoAAAAAAAAAAgAAAAAAAAABAAAAAQAAAFoAAAAGAAAAAAAAAAEAAAAAAAAAAAAAAAAAAAAAAAAAAAAAAAAAAAAAAAAAAAAAABYAAAAD/wBhAAAAAAEAAAANAAAAILu7u7u7u7u7u7u7u7u7u7u7u7u7u7u7u7u7u7u7u7u7AAAAAAAAAAAAAAAAAAAAAgAAAAMAAABaAAAABgAAAAAAAAABAAAAAAAAAAAAAAAAAAAAAAAAAAAAAAAAAAAAAAAAAAAAAAAWAAAAA/8AYQAAAAABAAAADQAAACC7u7u7u7u7u7u7u7u7u7u7u7u7u7u7u7u7u7u7u7u7uwAAAAAAAAABAAAAWgAAAAYAAAAAAAAAAQAAAAAAAAAAAAAAAAAAAAAAAAAAAAAAAAAAAAAAAAAAAAAAFgAAAAP/AGEAAAAAAQAAAA0AAAAgqqqqqqqqqqqqqqqqqqqqqqqqqqqqqqqqqqqqqqqqqqoAAAAAAAAAAAAAAAEAAAADAAAAWgAAAAYAAAAAAAAAAQAAAAAAAAAAAAAAAAAAAAAAAAAAAAAAAAAAAAAAAAAAAAAAFgAAAAP/AGEAAAAAAQAAAA0AAAAgqqqqqqqqqqqqqqqqqqqqqqqqqqqqqqqqqqqqqqqqqqoAAAAAAAAAAAAAAAAAAAAAAAAAAQAAAAMAAABaAAAABgAAAAAAAAABAAAAAAAAAAAAAAAAAAAAAAAAAAAAAAAAAAAAAAAAAAAAAAAWAAAAA/8AYQAAAAABAAAADQAAACCqqqqqqqqqqqqqqqqqqqqqqqqqqqqqqqqqqqqqqqqqqgAAAAAAAAAAAgAAAAAAAAAAAAAAAAAAAAAAAAAAAAAAAAAAAAAAAAAAAAAAAAAAAAAAAAAAAAAAAAAAAAAAAAEAAAADAAAAWgAAAAYAAAAAAAAAAQAAAAAAAAAAAAAAAAAAAAAAAAAAAAAAAAAAAAAAAAAAAAAAFgAAAAP/AGEAAAAAAQAAAA0AAAAgqqqqqqqqqqqqqqqqqqqqqqqqqqqqqqqqqqqqqqqqqqoAAAAAAAAAAwAAAAAAAAAAAAAAAQAAAAEAAAAEAAAAWgAAAAYAAAAAAAAAAQAAAAAAAAAAAAAAAAAAAAAAAAAAAAAAAAAAAAAAAAAAAAAAFgAAAAP/AGEAAAAAAQAAAA0AAAAgqqqqqqqqqqqqqqqqqqqqqqqqqqqqqqqqqqqqqqqqqqoAAAAAAAAAAAAAAAAAAAABAAAAAwAAAFoAAAAGAAAAAAAAAAEAAAAAAAAAAAAAAAAAAAAAAAAAAAAAAAAAAAAAAAAAAAAAABYAAAAD/wBhAAAAAAEAAAANAAAAIKqqqqqqqqqqqqqqqqqqqqqqqqqqqqqqqqqqqqqqqqqqAAAAAAAAAAEAAAABAAAAHQAAAAEAAAACAAAABgAAAAEAAAAAAAAAAAAAAAAAAAAAAAAAAAAAAAAAAAAAAAAAAAAAABYAAAAD/wBhAAAAAAEAAAAAAAAAAAAAAAAAAAABAAAABgAAAAEAAAAAAAAAAAAAAAAAAAAAAAAAAAAAAAAAAAAAAAAAAAAAABYAAAAD/wBhAAAAAAE="
    }
  ],
  "errors": []
}
